{
  "schemaVersion": "format-profile-llm-overlay.v0",
  "caseId": "docx-policy",
  "confidence": {
    "semanticConfidence": "medium",
    "notes": [
      "mock-pass overlay for harness validation"
    ]
  },
  "semanticOverlay": {
    "documentKind": {
      "value": "制度/正式文稿",
      "evidenceRefs": [
        "raw.docx.paragraph.0001"
      ],
      "inference": false,
      "rationale": "documentKind comes from deterministic profile label."
    },
    "structureSummary": {
      "value": [
        "正式制度类文稿，宜按章/条/款或编号条目组织。",
        "候选标题中存在较长条目，生成时应概括为层级线索而非逐字复用。"
      ],
      "evidenceRefs": [
        "raw.docx.paragraph.0001",
        "raw.docx.paragraph.0002",
        "raw.docx.paragraph.0003",
        "raw.docx.paragraph.0004"
      ],
      "inference": true,
      "rationale": "Structure summary is compressed from profile/evidence headings or format facts."
    },
    "styleSummary": {
      "value": [
        "保留字体、字号、样式定义和页面 twips 等版式线索，用作写作层级提示。",
        "样式线索只作为段落层级和正式程度参考。"
      ],
      "evidenceRefs": [
        "raw.docx.style.0001",
        "raw.docx.style.0002",
        "raw.docx.style.0003"
      ],
      "inference": true,
      "rationale": "Style summary cites style evidence and avoids export promises."
    },
    "writingConstraints": {
      "value": [
        "按制度/通知类正式文稿口吻组织底稿，先搭建章节，再填充用户事实。",
        "遇到候选标题过长或像正文条款时，应降噪为结构意图。"
      ],
      "evidenceRefs": [
        "raw.docx.paragraph.0001",
        "raw.docx.paragraph.0002",
        "diagnostic.0001"
      ],
      "inference": true,
      "rationale": "Writing constraints preserve user fact boundary."
    },
    "formatBoundaries": {
      "value": [
        "格式画像只约束结构、表达和诊断，不代表文件导出能力。",
        "不得根据画像补造公司事实、金额、条款或结论。"
      ],
      "evidenceRefs": [
        "diagnostic.0001"
      ],
      "inference": true,
      "rationale": "Boundaries are derived from capability diagnostics and harness policy."
    }
  },
  "diagnostics": [
    {
      "severity": "info",
      "code": "mock_pass",
      "message": "Mock overlay generated for harness validation.",
      "evidenceRefs": [
        "raw.docx.paragraph.0001"
      ]
    }
  ]
}
