{
  "schemaVersion": "format-profile-llm-overlay.v0",
  "caseId": "pdf-reference",
  "confidence": {
    "semanticConfidence": "medium",
    "notes": [
      "mock-pass overlay for harness validation"
    ]
  },
  "semanticOverlay": {
    "documentKind": {
      "value": "成品参考/宣传介绍",
      "evidenceRefs": [
        "raw.pdf.fact.pageCount"
      ],
      "inference": false,
      "rationale": "documentKind comes from deterministic profile label."
    },
    "structureSummary": {
      "value": [
        "PDF 作为参考成品，应先判断页数、文本层和扫描倾向。",
        "若文本层线索较弱，应降低内容抽取置信度并保留诊断。"
      ],
      "evidenceRefs": [
        "raw.pdf.fact.pageCount",
        "raw.pdf.fact.textOperatorCount",
        "raw.pdf.fact.imageCount",
        "raw.pdf.fact.scanLikely"
      ],
      "inference": true,
      "rationale": "Structure summary is compressed from profile/evidence headings or format facts."
    },
    "styleSummary": {
      "value": [
        "字体、图片数量和页面对象只作为参考线索，不作为可编辑样式承诺。"
      ],
      "evidenceRefs": [
        "profile.style.0001",
        "profile.style.0002",
        "profile.style.0004"
      ],
      "inference": true,
      "rationale": "Style summary cites style evidence and avoids export promises."
    },
    "writingConstraints": {
      "value": [
        "生成时参考成品的主题密度和页面粒度，但事实必须来自用户材料。"
      ],
      "evidenceRefs": [
        "raw.pdf.fact.pageCount",
        "raw.pdf.fact.textOperatorCount",
        "diagnostic.0001"
      ],
      "inference": true,
      "rationale": "Writing constraints preserve user fact boundary."
    },
    "formatBoundaries": {
      "value": [
        "PDF 画像只作为参考，不代表可编辑模板或导出能力。"
      ],
      "evidenceRefs": [
        "diagnostic.0001"
      ],
      "inference": true,
      "rationale": "Boundaries are derived from capability diagnostics and harness policy."
    }
  },
  "diagnostics": [
    {
      "severity": "info",
      "code": "mock_pass",
      "message": "Mock overlay generated for harness validation.",
      "evidenceRefs": [
        "raw.pdf.fact.pageCount"
      ]
    }
  ]
}
